{
  "$schema": "https://json-schema.org/draft/2020-12/schema",
  "$id": "https://prompting-press.dev/schemas/prompt-definition.schema.json",
  "title": "PromptDefinition",
  "description": "The single source of truth for a prompt's shape (constitution Principle VII / C-07). Per-language shapes (Pydantic v2 / TypeScript types / Rust serde structs) are code-generated from THIS document; it is never hand-mirrored. The library authors, generates, and round-trips this shape; it does not render, validate, or resolve it (Principle III — that lives in specs 002+). $id is a stable identity, not a live endpoint (research D5).",
  "type": "object",
  "additionalProperties": false,
  "required": ["name", "role", "body"],
  "properties": {
    "name": {
      "type": "string",
      "minLength": 1,
      "description": "Logical prompt name; the caller's reference key."
    },
    "role": {
      "type": "string",
      "enum": ["system", "user", "assistant"],
      "description": "Conversational role; first-class metadata the caller reads. Shared across all variants."
    },
    "body": {
      "type": "string",
      "description": "The DEFAULT variant's template source. The root body IS the default arm (FR-011); surfaced under reserved name 'default' with is_default=true."
    },
    "variables": {
      "type": "object",
      "description": "Declared input variables, shared across all variants. Each entry declares the variable's type and input-trust origin.",
      "additionalProperties": { "$ref": "#/$defs/PromptVariable" },
      "default": {}
    },
    "variants": {
      "type": "object",
      "description": "Named alternative arms. Absent => the prompt has only the default (root body) arm. Each arm differs ONLY in body (+ optional opaque metadata).",
      "additionalProperties": { "$ref": "#/$defs/PromptVariant" },
      "propertyNames": {
        "not": { "const": "default" },
        "description": "A variants entry named 'default' is rejected (FR-011b): it collides with the structural default arm (the root body)."
      }
    },
    "output_model": {
      "type": "string",
      "description": "Optional OPAQUE reference to the caller's output model (e.g. 'NodeOutput'). Stored and echoed; never resolved, loaded, or parsed (Principle III). Shared across variants."
    },
    "metadata": {
      "type": "object",
      "description": "Arbitrary prompt-level metadata; library-OPAQUE (may include uninterpreted model/param hints, selection labels like weight/group/tags, or a `guard` key). Stored and echoed; never interpreted by the library. The prompt and each variant each carry exactly one `metadata` bag.",
      "additionalProperties": true
    }
  },
  "$defs": {
    "PromptVariable": {
      "type": "object",
      "description": "A declared input variable: type, trust flag, and an optional human-readable description. Validation constraints belong in the per-language validator (Zod/Pydantic/garde); the kernel is validation-blind.",
      "required": ["type", "trusted"],
      "properties": {
        "type": {
          "oneOf": [
            { "type": "string", "enum": ["string", "integer", "number", "boolean", "array", "object"] },
            { "type": "array", "items": { "type": "string", "enum": ["string", "integer", "number", "boolean", "array", "object", "null"] } }
          ],
          "description": "JSON-Schema type keyword(s) for the variable."
        },
        "trusted": {
          "type": "boolean",
          "description": "Per-field input-trust flag (spec 015). `true` ⇒ a trusted input (never delimited). `false` ⇒ untrusted input: when the opt-in guard is enabled, the variable's interpolated value is wrapped in injection-resistant `<untrusted>…</untrusted>` delimiters in the rendered body, and the guard advisory references the markers. Replaces the former `origin` enum (trusted|untrusted|external) — with one fixed delimiter the untrusted/external distinction was no longer meaningful. Use `check()` to detect untrusted variables (`trusted: false`) that lack a declared guard."
        },
        "validation_required": {
          "type": "boolean",
          "default": false,
          "description": "When true, a validator covering this variable MUST be supplied when the Prompt is constructed (spec 008). Orthogonal to `trusted` — it MAY mark any variable, trusted or not. Declarative metadata; enforcement is per-language (constitution Principle VI v1.2.0): TypeScript (Zod) and Python (Pydantic) introspect the supplied validator and throw/raise at construction if this variable is uncovered, while Rust guarantees coverage structurally at compile time. The kernel never reads this field (validation-blind)."
        },
        "description": {
          "type": "string",
          "description": "Optional human-readable description of the variable."
        }
      },
      "additionalProperties": false
    },
    "PromptVariant": {
      "type": "object",
      "description": "A named alternative arm. May carry ONLY body and metadata; redefining role/variables/output_model is rejected (FR-011a).",
      "required": ["body"],
      "properties": {
        "body": {
          "type": "string",
          "description": "The variant's template source — the only field that differs per variant."
        },
        "metadata": {
          "type": "object",
          "description": "Library-OPAQUE per-variant metadata (selection labels like weight/group/tags, or a `guard` key). Stored + exposed; never interpreted by the library (caller selects). No schema-enforced selection semantics (FR-011c). Mirrors the prompt-level `metadata` bag.",
          "additionalProperties": true
        }
      },
      "additionalProperties": false
    }
  }
}
