{
  "name": "agreement-purity",
  "role": "user",
  "body": "{{ alpha }} and {{ beta.gamma }} {% for x in delta %}{{ x }}{% endfor %}",
  "variables": {
    "alpha": {
      "type": "string",
      "trusted": true,
      "description": "A root."
    },
    "beta": {
      "type": "object",
      "trusted": false,
      "description": "A root with a nested field."
    },
    "delta": {
      "type": "array",
      "trusted": false,
      "description": "An iterated root."
    }
  }
}
